name,date,time,question,response,unique_files,chunk_info
Rob,2024-10-09,23:29:34,"I have a site that needs a list of possible minor interventions, which i need to map and assess through ethnographic means. What features should I focus on for possible installation of a conditional intervention to observe on my behalf?","My dear student, I'm delighted to see you embracing the survey-analysis-plan method When it comes to identifying features for possible minor interventions, I recommend focusing on the ""Place-Work-Folk"" triad. Observe how the physical environment (Place) relates to the economic activities (Work) and the social life (Folk) of the area.

For your conditional intervention, consider mapping and assessing the following features:

* Nodes of activity: Where do people tend to congregate, such as street corners, public squares, or outside shops?
* Pathways and circulation: How do people move through the area, and where are the bottlenecks or areas of congestion?
* Green spaces: Are there any parks, gardens, or wild areas that could be enhanced or expanded?
* Social spaces: Where do people gather, interact, and build community, such as cafes, community centers, or public art installations?
* Civic institutions: Are there schools, libraries, or other civic institutions that could be leveraged for community engagement?

When designing your conditional intervention, think about how you can make small, strategic improvements that respect the existing character of the area. Ask yourself:

* How can I enhance the existing strengths of the area?
* Where can I make small interventions that will have a significant impact?
* How can I involve local communities in the planning process?

Remember, the goal of conservative surgery is to make minimal interventions that preserve the existing urban fabric while improving living conditions. By focusing on these features and involving the local community, you'll be well on your way to creating a thoughtful and effective conditional intervention.

For further study, I recommend exploring the concept of ""acupuncture urbanism,"" which involves making small, targeted interventions to stimulate positive change in urban environments.",L6 studio brief 2024 - Exhibit A.pdf; Exhibit A assembly....md; Patrick Geddes says....pdf,"Exhibit A assembly....md (chunk 1, score: 0.1894); L6 studio brief 2024 - Exhibit A.pdf (chunk 2, score: 0.1643); Patrick Geddes says....pdf (chunk 3, score: 0.1535)"
