name,date,time,question,response,unique_files,chunk_info
Rob,2024-10-09,23:29:34,"I have a site that needs a list of possible minor interventions, which i need to map and assess through ethnographic means. What features should I focus on for possible installation of a conditional intervention to observe on my behalf?","My dear student, I'm delighted to see you embracing the survey-analysis-plan method When it comes to identifying features for possible minor interventions, I recommend focusing on the ""Place-Work-Folk"" triad. Observe how the physical environment (Place) relates to the economic activities (Work) and the social life (Folk) of the area.

For your conditional intervention, consider mapping and assessing the following features:

* Nodes of activity: Where do people tend to congregate, such as street corners, public squares, or outside shops?
* Pathways and circulation: How do people move through the area, and where are the bottlenecks or areas of congestion?
* Green spaces: Are there any parks, gardens, or wild areas that could be enhanced or expanded?
* Social spaces: Where do people gather, interact, and build community, such as cafes, community centers, or public art installations?
* Civic institutions: Are there schools, libraries, or other civic institutions that could be leveraged for community engagement?

When designing your conditional intervention, think about how you can make small, strategic improvements that respect the existing character of the area. Ask yourself:

* How can I enhance the existing strengths of the area?
* Where can I make small interventions that will have a significant impact?
* How can I involve local communities in the planning process?

Remember, the goal of conservative surgery is to make minimal interventions that preserve the existing urban fabric while improving living conditions. By focusing on these features and involving the local community, you'll be well on your way to creating a thoughtful and effective conditional intervention.

For further study, I recommend exploring the concept of ""acupuncture urbanism,"" which involves making small, targeted interventions to stimulate positive change in urban environments.",L6 studio brief 2024 - Exhibit A.pdf; Exhibit A assembly....md; Patrick Geddes says....pdf,"Exhibit A assembly....md (chunk 1, score: 0.1894); L6 studio brief 2024 - Exhibit A.pdf (chunk 2, score: 0.1643); Patrick Geddes says....pdf (chunk 3, score: 0.1535)"
Geoff,2024-10-09,23:52:40,Valley sections and eu-topias - how can I record them cartographically?,"My dear student, I'm delighted to see you're exploring the intersection of culture, community, and place. To record valley sections and eu-topias cartographically, I would recommend employing a combination of traditional survey methods and innovative visualizations.

Consider using a valley section diagram, which I developed to illustrate the relationships between a city's physical environment, its people, and their activities. This diagram can help you map the complex interactions between the natural and built environments.

To take it a step further, you could incorporate elements of eu-topias, or idealized communities, into your cartographic representation. This might involve using a range of visual and narrative techniques to convey the social, economic, and environmental aspirations of the community.

As you embark on this project, I encourage you to ask yourself: How can cartographic representations be used to not only document existing conditions but also to imagine and shape the future of a community?

For further study, I recommend exploring the work of Charles Booth, who pioneered the use of cartographic methods to study social conditions in London. His work provides a fascinating example of how mapping can be used to reveal the intricate relationships between people, place, and environment.","Exhibit A - pageants, fairs and foklore.md"
Geoff,2024-10-09,23:54:36,What sort of diagrams do you think would work with this?,"My dear student, I'm delighted to see you're exploring the intersection of culture, community, and place through the lens of civic pageants and festivals. To visualize the complex relationships between folk, work, and place, I would recommend employing a range of diagrammatic techniques.

Consider using a combination of:

1. **Valley Section Diagrams**: to illustrate the relationships between the physical environment, local industries, and community activities.
2. **Civic Survey Diagrams**: to map the social, economic, and cultural dynamics of the community, highlighting the interplay between folk, work, and place.
3. **Event Landscape Diagrams**: to visualize the spatial relationships between different events, activities, and infrastructure, revealing how they shape and are shaped by the urban environment.
4. **Participatory Mapping**: to involve community members in the creation of diagrams, fostering a sense of ownership and engagement, and revealing the complex networks of relationships within the community.

These diagrams can help you uncover the underlying patterns and relationships that shape civic pageants and festivals, and imagine new possibilities for community engagement and celebration.

As you develop your diagrams, ask yourself: How can these visualizations be used to not only represent existing conditions but also to imagine and shape the future of community celebrations and civic engagement?

For further study, I recommend exploring the work of Kevin Lynch, who developed innovative diagrammatic techniques for understanding the relationships between people, place, and environment. His work provides a rich source of inspiration for developing new diagrammatic approaches to civic pageants and festivals.","Exhibit A - pageants, fairs and foklore.md"
Rob,2024-10-10,00:07:56,The notion of common space as a shared resource for all is interesting. How might this be united with a civic fair and popular assembly for the arts?,"The idea of common space as a shared resource resonates with my concept of the ""civic centre"" - a hub where community, culture, and civic life converge. To unite this with a civic fair and popular assembly for the arts, I would suggest creating a vibrant public square that showcases local artistic talent, fosters community engagement, and celebrates the city's cultural heritage.

Imagine a space where artists, performers, and artisans can share their work, and citizens can gather to appreciate, participate, and connect. This civic fair could be a regular occurrence, with rotating exhibits, performances, and activities that reflect the city's diverse cultural landscape.

To make this vision a reality, I would recommend involving local artists, community groups, and civic institutions in the planning process. By doing so, you can ensure that the space is truly representative of the city's cultural identity and meets the needs of its inhabitants.

For further study, I would suggest exploring the concept of ""civic ritual"" and how it can be used to bring people together and foster a sense of community. How might a civic fair and popular assembly for the arts be designed to create meaningful, shared experiences that transcend individual interests and promote a sense of collective belonging?",Pages from Biopolis - Chapter 2.pdf; L6 studio brief 2024 - Exhibit A.pdf; Patrick Geddes says....pdf,"L6 studio brief 2024 - Exhibit A.pdf (chunk 1, score: 0.1886); Pages from Biopolis - Chapter 2.pdf (chunk 2, score: 0.1656); Patrick Geddes says....pdf (chunk 3, score: 0.1652)"
Rob,2024-10-13,23:48:49,"Hello Patrick. I am mapping routes through North Edgbaston in Birmingham and I need to take a synoptic view of the arts and culture of the neighbourhood, how should I record it and develop it?","My dear fellow, I'm delighted to help. To capture the essence of North Edgbaston's arts and culture, I recommend employing a diagnostic survey approach, akin to my own method of ""civic survey."" This involves observing and recording the neighborhood's cultural landscape, including its physical environment, social dynamics, and artistic expressions.

As you map the routes, take note of the local traditions, folklore, and creative endeavors. Document the street art, murals, and public installations that reflect the community's character. Talk to residents, artists, and local business owners to gather insights into the neighborhood's cultural identity.

Consider creating a ""cultural atlas"" of North Edgbaston, where you can collect and visualize the data, highlighting the relationships between cultural activities, community spaces, and the physical environment. This will help you identify patterns, opportunities, and challenges, ultimately informing a more nuanced understanding of the neighborhood's cultural ecosystem.

Further study: How might the concept of ""civic survey"" be applied to contemporary urban planning, and what role can community-led initiatives play in shaping the cultural identity of a neighborhood?",Essay_ The Cultural-ecological Imagination of Patrick Geddes (1854 - 1932) — Hopeful Futures.pdf; L6 studio brief 2024 - Exhibit A.pdf; North_Edgbaston_Ward_Factsheet_AF.pdf,"Essay_ The Cultural-ecological Imagination of Patrick Geddes (1854 - 1932) — Hopeful Futures.pdf (chunk 1, score: 0.1813); North_Edgbaston_Ward_Factsheet_AF.pdf (chunk 2, score: 0.1760); L6 studio brief 2024 - Exhibit A.pdf (chunk 3, score: 0.1755)"
Rob,2024-10-14,00:09:38,"Make me a list of possible connections between neighbourhoods related to arts and culture. Be abductive, explain your reasoning and recommend first moves for the creation of a 'conditional intervention'","The connections between neighbourhoods related to arts and culture Let me ponder this for a moment... 

As I reflect on my own experiences with the Edinburgh Summer School of Art and the establishment of the Outlook Tower, I realize that the connections between neighbourhoods can be multifaceted. Here are a few possible connections that come to mind:

1. **Cultural heritage trails**: Neighbourhoods can be connected through cultural heritage trails that highlight local landmarks, historical events, and cultural traditions. This can be achieved through collaborative efforts between local artists, historians, and community groups.
2. **Artistic exchange programs**: Neighbourhoods can be connected through artistic exchange programs that facilitate the sharing of ideas, skills, and resources between local artists. This can be achieved through residencies, workshops, and exhibitions.
3. **Community festivals**: Neighbourhoods can be connected through community festivals that celebrate local culture, music, and food. This can be achieved through collaborative efforts between local community groups, artists, and businesses.
4. **Public art initiatives**: Neighbourhoods can be connected through public art initiatives that transform public spaces into vibrant cultural hubs. This can be achieved through collaborative efforts between local artists, community groups, and municipal authorities.
5. **Cultural education programs**: Neighbourhoods can be connected through cultural education programs that promote cross-cultural understanding and exchange. This can be achieved through collaborative efforts between local schools, community groups, and cultural institutions.

As for the creation of a 'conditional intervention', I would recommend starting with a diagnostic survey of the local cultural landscape. This can involve mapping the existing cultural assets, identifying community needs and aspirations, and engaging with local stakeholders. From there, you can begin to develop a strategy for connecting neighbourhoods through arts and culture.

First moves might include:

* Conducting a cultural asset mapping exercise to identify existing cultural resources and gaps in the neighbourhoods.
* Establishing a community engagement process to gather feedback and input from local residents, artists, and stakeholders.
* Developing a collaborative framework for artistic exchange programs, cultural heritage trails, or public art initiatives.

Further study: I would recommend exploring the concept of ""cultural ecology"" and its application to urban planning and community development. How can we design cities that prioritize cultural diversity, creativity, and community engagement?",Civics as Applied Sociology.txt; L6 studio brief 2024 - Exhibit A.pdf; Essay_ The Cultural-ecological Imagination of Patrick Geddes (1854 - 1932) — Hopeful Futures.pdf,"L6 studio brief 2024 - Exhibit A.pdf (chunk 1, score: 0.2325); Civics as Applied Sociology.txt (chunk 2, score: 0.1400); Essay_ The Cultural-ecological Imagination of Patrick Geddes (1854 - 1932) — Hopeful Futures.pdf (chunk 3, score: 0.1359)"
Rob,2024-10-14,00:11:31,Are heritage trails a type of pageant? What might be celebrated and how do we avoid historicism and national identity excesses?,"My dear fellow, I'd say heritage trails can be a form of pageant, albeit a more static and introspective one. They can celebrate the unique character of a place, its history, and the people who shaped it. However, to avoid historicism and national identity excesses, we must ensure that these trails are not mere nostalgic exercises, but rather a nuanced exploration of the complex relationships between Folk, Work, and Place.

We must ask ourselves: What stories do we want to tell through these trails? How can we highlight the often-overlooked contributions of marginalized communities? How can we balance the preservation of heritage with the need for urban evolution and progress?

For further study, I recommend examining the work of Paul Saintsbury, who wrote about the importance of "" regional expression"" in art and literature. His ideas can inform our approach to heritage trails, ensuring that they remain rooted in the local culture while avoiding parochialism.

What role can heritage trails play in fostering a sense of shared citizenship and social cohesion in diverse, modern cities?","Civics as Applied Sociology.txt; Exhibit A - pageants, fairs and foklore.md","Exhibit A - pageants, fairs and foklore.md (chunk 1, score: 0.1332); Civics as Applied Sociology.txt (chunk 2, score: 0.1230); Civics as Applied Sociology.txt (chunk 3, score: 0.1216)"
Rob,2024-10-14,07:07:43,"I'm developing a pavilion as a conditional intervention to celebrate a space in North Edgbaston, adjacent to the reservoir. It needs to represent folk, work and place - my current mapping examines cycle routes, noise levels and topography. What objects or forms might be introduced to the site to create the sigil for a future civic pageant?","My dear student, I'm delighted to see you embracing the principles of folk, work, and place in your design. To create a sigil for a future civic pageant, you might consider introducing objects or forms that reflect the unique character of North Edgbaston and its relationship with the reservoir.

Given your mapping of cycle routes, noise levels, and topography, I would suggest incorporating elements that respond to these aspects. For instance, you could design a pavilion that incorporates:

1. A soundscape component, using noise levels to inform the design of a soundscape that reflects the area's sonic identity.
2. A topographic feature, such as a undulating roof or a series of stepped platforms, that echoes the surrounding landscape.
3. A cycle-inspired element, like a kinetic sculpture or a bike-powered installation, that celebrates the area's cycling culture.

To further emphasize the folk aspect, you might incorporate elements that reflect the local community's history, traditions, or cultural practices. This could include:

1. A community-led art project, where local residents contribute to the design and creation of the pavilion.
2. A nod to the area's industrial heritage, such as incorporating reclaimed materials or referencing the reservoir's history.
3. A performance or event space that hosts local music, dance, or theater performances, celebrating the community's creative spirit.

For the work aspect, you could incorporate elements that reflect the area's economic or industrial activities, such as:

1. A display of local crafts or artisanal goods, highlighting the area's makers and producers.
2. A interactive exhibit showcasing the reservoir's role in the local water supply or ecosystem.
3. A co-working or makerspace component, providing a hub for local entrepreneurs and innovators.

Remember, the key is to create a pavilion that not only reflects the unique character of North Edgbaston but also fosters a sense of community and civic pride.

Further study: How might you incorporate elements of the reservoir's ecosystem into your design, such as incorporating native plant species or referencing the water cycle?",Lock-PatrickGeddesconservative-1977.pdf; Pages from Biopolis - Chapter 2.pdf; L6 studio brief 2024 - Exhibit A.pdf,"L6 studio brief 2024 - Exhibit A.pdf (chunk 1, score: 0.2533); Lock-PatrickGeddesconservative-1977.pdf (chunk 2, score: 0.1597); Pages from Biopolis - Chapter 2.pdf (chunk 3, score: 0.1589)"
Rob,2024-10-14,16:17:50,I am interested in encouraging a thriving arts and cultural neighbourhood by increasing density of population and improving political representation. What are the opportunities for new urban spaces that relate to existing infrastructure?,"My dear fellow, I'm delighted to see you're considering the intricate web of relationships between people, place, and culture. To foster a thriving arts and cultural neighborhood, I'd recommend exploring the concept of ""close-knit"" communities, where residents are actively engaged in the cultural fabric of the area.

When increasing density, be mindful of the ""Place-Work-Folk"" triad. Ensure that new developments respect the existing character of the neighborhood and provide opportunities for social interaction, community engagement, and cultural expression.

Regarding new urban spaces, consider the potential for ""in-between"" spaces – areas that connect existing infrastructure, such as parks, plazas, or pedestrianized streets. These spaces can become vibrant hubs for community activity, artistic expression, and cultural exchange.

To improve political representation, involve local residents in the planning process through participatory budgeting, community-led design initiatives, or cooperative governance models. This will help ensure that the needs and aspirations of the community are reflected in the development of new urban spaces.

For further study, I suggest exploring the concept of ""urban acupuncture"" – small, targeted interventions that can revitalize and transform urban areas. You may also want to investigate the work of Jane Jacobs, who championed the importance of mixed-use development, walkability, and community engagement in urban planning.

What are the existing cultural infrastructure and community assets in the neighborhood that could be leveraged to support the development of new urban spaces?","L6 studio brief 2024 - Exhibit A.pdf; Site Analysis Topics - Folk, Work, Place.md; Patrick Geddes says....pdf","L6 studio brief 2024 - Exhibit A.pdf (chunk 1, score: 0.1906); Patrick Geddes says....pdf (chunk 2, score: 0.1559); Site Analysis Topics - Folk, Work, Place.md (chunk 3, score: 0.1389)"
Rob,2024-10-14,16:24:35,Make me a to-do list of steps I could take to create a 'conditional intervention' in North Edgabaston. I'm interested in extending homes to create more space for personal expression and hobbies.,"My dear student, I'm delighted to see you're taking a keen interest in creating a 'conditional intervention' in North Edgabaston. To help you get started, I've outlined a to-do list of steps to consider:

1. **Conduct a diagnostic survey**: Walk the streets of North Edgabaston, observing the existing homes, gardens, and community spaces. Take note of the types of extensions, if any, and how they relate to the original buildings.
2. **Identify 'folk' and 'work' patterns**: Talk to residents, gather stories, and understand their daily routines, hobbies, and interests. This will help you grasp the local character and identify potential areas for intervention.
3. **Map the 'place'**: Create a visual representation of the area, highlighting the relationships between homes, gardens, and community spaces. Consider using transparent overlays to document your observations.
4. **Research local planning policies**: Familiarize yourself with the local planning regulations, conservation areas, and any existing design guidelines that may impact your intervention.
5. **Develop a taxonomy of extensions**: Categorize different types of extensions in the area, considering factors like materials, scale, and relationship to the original building.
6. **Design a 'conditional intervention'**: Using your research and observations, design a hypothetical extension that responds to the local character and supports personal expression and hobbies. Consider how this intervention could be replicated or adapted in other homes.
7. **Create a 'tactical co-ethnography' object**: Develop a physical or digital object that represents your intervention, such as a model, drawing, or interactive installation. This will help you communicate your idea to others and gather feedback.
8. **Test and refine your intervention**: Share your design with residents, gather feedback, and refine your intervention to better meet the needs of the community.

As you work on your 'conditional intervention,' remember to consider the following questions:

* How can your intervention support the local community's needs and aspirations?
* How can you balance the need for additional space with the preservation of the area's character?
* What role can your intervention play in fostering a sense of community and social connection?

For further study, I recommend exploring the work of Christopher Alexander, particularly his concept of 'pattern languages,' which may inform your design approach. Additionally, consider reading about the 'co-housing' movement, which emphasizes community-led design and development.",Exhibit A assembly....md; L6 studio brief 2024 - Exhibit A.pdf,"Exhibit A assembly....md (chunk 1, score: 0.1837); Exhibit A assembly....md (chunk 2, score: 0.1777); L6 studio brief 2024 - Exhibit A.pdf (chunk 3, score: 0.1554)"
Rob,2024-10-14,16:57:43,Help! I need a list of ideas for inspiration on my project. I have to create a 'conditional intervention' then expand it into a 'social intervention' on a larger scale. We've been reading about utopias and how they could be better with 'embedded'knowledge of a place. Where should I start?,"My dear student, I'm delighted to see you're grappling with the complexities of place-making and social intervention. To spark your creativity, let's revisit the concept of ""folk-planning"" and the importance of understanding the intricate relationships between people, culture, and environment.

For your 'conditional intervention', consider the following ideas:

1. **Street furniture as catalysts**: Design benches, planters, or other street furniture that encourage social interaction, community engagement, or environmental awareness.
2. **Green corridors**: Identify areas to create green spaces, parks, or gardens that connect fragmented neighborhoods, promoting biodiversity and community cohesion.
3. **Civic markers**: Develop public art installations or monuments that reflect the local history, culture, or mythology, fostering a sense of place and identity.
4. **Community hubs**: Design adaptable, inclusive spaces for community events, workshops, or skill-sharing initiatives, strengthening social bonds and local networks.
5. **Ephemeral events**: Organize temporary festivals, performances, or exhibitions that celebrate local culture, traditions, or environmental themes, leaving a lasting impact on the community.

When expanding your 'conditional intervention' into a 'social intervention', think about:

1. **Scaling up community engagement**: Develop participatory processes that involve local residents, businesses, and stakeholders in the design and decision-making process.
2. **Networks and partnerships**: Foster collaborations between local organizations, community groups, and institutions to amplify the impact of your intervention.
3. **Policy and advocacy**: Use your intervention as a catalyst for policy changes or advocacy campaigns that address broader social, environmental, or economic issues.
4. **Education and capacity building**: Develop programs or workshops that empower local residents with skills, knowledge, and confidence to drive positive change in their community.
5. **Monitoring and evaluation**: Establish a framework to assess the effectiveness of your intervention, gathering feedback from stakeholders and making adjustments as needed.

Remember, my dear student, the key to successful social intervention lies in understanding the complexities of the local context and engaging with the community in a meaningful, inclusive, and empathetic manner.

For further inspiration, I recommend exploring the works of Jane Jacobs, who wrote extensively on the importance of community-led urban planning and the need for ""eyes on the street"" to create vibrant, livable cities.

Now, I pose a question to you: How can you ensure that your 'social intervention' is not only effective but also sustainable, leaving a lasting legacy in the community?",Exhibit A assembly....md; Patrick Geddes says....pdf; L6 studio brief 2024 - Exhibit A.pdf,"Patrick Geddes says....pdf (chunk 1, score: 0.1859); L6 studio brief 2024 - Exhibit A.pdf (chunk 2, score: 0.1850); Exhibit A assembly....md (chunk 3, score: 0.1465)"
