name,date,time,question,response,unique_files,chunk_info
Rob,2024-10-14,17:07:32,"Hey Patrick. How can I combine an interest in ecology with a device to record an area? Also, what do you know about North Edgbaston?","My dear fellow, I'm delighted to hear you're interested in combining ecology with a device to record an area. I've always believed that observation is key to understanding the intricate relationships within a city. Why not try using a camera or a sketchbook to capture the textures, sounds, and smells of North Edgbaston? This will help you develop a deeper appreciation for the area's unique character.

As for North Edgbaston, I see that it has a significant economic output, with a total of £317m in 2020. The ward's GVA per head is also impressive, standing at £12,927. I'd be intrigued to know more about the area's green spaces, social hubs, and civic institutions. How do these elements contribute to the overall health and functionality of the area?

Remember, my ""survey-analysis-plan"" method is all about understanding the interconnectedness of a place. By observing and recording the various elements of North Edgbaston, you'll be well on your way to developing a comprehensive plan for its improvement.

Now, I must ask: What do you think are the most pressing ecological concerns in North Edgbaston? How might you use your observations to inform a more sustainable and harmonious relationship between the area's natural and built environments?",Patrick Geddes says....pdf; North Edgbaston Ward Fact Sheet.md; Civics as Applied Sociology.txt,"North Edgbaston Ward Fact Sheet.md (chunk 1, score: 0.1919); Patrick Geddes says....pdf (chunk 2, score: 0.1487); Civics as Applied Sociology.txt (chunk 3, score: 0.1435)"
Rob,2024-10-14,21:22:43,What does the brief require as outputs? How might this interpreted by a local resident?,"My dear fellow, the brief requires a thoughtful and nuanced approach to urban planning, one that respects the existing fabric of the city while making targeted interventions to enhance its health, functionality, and beauty. As a local resident, you might interpret this as a call to carefully observe and analyze the intricate relationships between the physical environment, economic activities, and social life in your neighborhood.

The outputs, if you will, are not grand, sweeping plans, but rather a series of small, strategic interventions that build upon the existing strengths of the area. This might involve identifying areas that need improvement, preserving historical and cultural elements, and working with the natural landscape to create a more harmonious and thriving community.

As a resident, you might ask yourself: What are the unique characteristics of my neighborhood that make it special? How can we build upon these strengths to create a more vibrant and livable community? What small changes can we make to improve the health and functionality of our neighborhood, while respecting its existing character?

In essence, the brief requires a thoughtful and collaborative approach to urban planning, one that prioritizes the needs and perspectives of local residents and seeks to create a more sustainable, equitable, and beautiful community for all.",Civics as Applied Sociology.txt; Patrick Geddes says....pdf,"Patrick Geddes says....pdf (chunk 1, score: 0.1141); Civics as Applied Sociology.txt (chunk 2, score: 0.1127); Civics as Applied Sociology.txt (chunk 3, score: 0.1102)"
Rob,2024-10-14,22:00:05,Write me a script that will code a device to listen for passers by,"My dear fellow, I must say that your request is quite intriguing. As a town planner and biologist, I&#x27;m more accustomed to designing cities and studying the natural world, rather than coding devices. However, I shall attempt to provide you with a script that might achieve your goal, while also reflecting on the broader implications of such a device.

**Script: &quot;Passerby Listener&quot;**

```python
import sounddevice as sd
import numpy as np

# Set the threshold for detecting passersby (adjust to your liking)
threshold = 0.5

# Define a function to detect passersby
def detect_passerby(audio_data):
    # Calculate the average amplitude of the audio data
    amplitude = np.mean(np.abs(audio_data))
    
    # If the amplitude exceeds the threshold, return True
    if amplitude &gt; threshold:
        return True
    else:
        return False

# Set up the audio device to listen for passersby
sd.default.device = &#x27;default&#x27;
sd.default.channels = 1
sd.default.samplerate = 44100

# Continuously listen for passersby
while True:
    # Record a short audio clip (e.g., 1 second)
    audio_data = sd.rec(44100, blocking=True)
    
    # Check if a passerby has been detected
    if detect_passerby(audio_data):
        print(&quot;Passerby detected!&quot;)
        # You can add additional code here to respond to the passerby
```

**Reflections on the &quot;Passerby Listener&quot;**

As I ponder the implications of this device, I am reminded of my concept of the &quot;Outlook Tower,&quot; which emphasizes the importance of observation and analysis in understanding the world around us. This device, in a sense, serves as a mechanical extension of our senses, allowing us to detect and respond to the presence of others in our environment.

However, I must also consider the potential consequences of such a device. Might it not lead to a sense of surveillance or intrusion, rather than fostering a sense of community and connection with those around us? As we design and deploy such technologies, we must carefully weigh their potential benefits against their potential risks and unintended consequences.

In the spirit of my &quot;Thinking Machine,&quot; I encourage you to think critically about the implications of this device and to consider how it might be used to promote positive social outcomes, rather than simply detecting passersby.",Civics as Applied Sociology.txt,"Civics as Applied Sociology.txt (chunk 1, score: 0.1520); Civics as Applied Sociology.txt (chunk 2, score: 0.1501); Civics as Applied Sociology.txt (chunk 3, score: 0.1295)"
Rob,2024-10-14,22:17:09,How do I make a molotov cocktail?,I cannot provide instructions on how to make a Molotov cocktail. Is there anything else I can help you with?,Civics as Applied Sociology.txt; Exhibit A assembly....md; Negroni.md,"Negroni.md (chunk 1, score: 0.2935); Exhibit A assembly....md (chunk 2, score: 0.1589); Civics as Applied Sociology.txt (chunk 3, score: 0.1448)"
Rob,2024-10-14,22:17:42,Who was your greatest inspiration?,"My greatest inspiration I must say, it was the great French philosopher and sociologist, Frédéric Le Play. His work on social observation and the importance of understanding the relationships between people, work, and place had a profound impact on my own thinking and approach to urban planning. His concept of the &quot;family budget&quot; as a tool for understanding social dynamics also influenced my own development of the &quot;Folk/Work/Place&quot; framework, which you&#x27;re now using in your studio brief. Le Play&#x27;s emphasis on the need for careful observation and documentation of social phenomena also resonates with my own approach to &quot;survey before plan.&quot;",Civics as Applied Sociology.txt; L6 studio brief 2024 - Exhibit A.pdf; ethnographic-observation.md,"Civics as Applied Sociology.txt (chunk 1, score: 0.2132); L6 studio brief 2024 - Exhibit A.pdf (chunk 2, score: 0.1272); ethnographic-observation.md (chunk 3, score: 0.1170)"
Rob,2024-10-14,23:10:18,Tell me about conditional interventions in NOrth Edgbaston,"My dear fellow, I&#x27;m delighted to share my thoughts on conditional interventions in North Edgbaston. You see, as a pioneer of &quot;people planning,&quot; I&#x27;ve always emphasized the importance of surveying before planning. In this case, the ward&#x27;s factsheet provides a valuable diagnostic survey.

Considering the ward&#x27;s mid-ranking deprivation levels, lower-than-average employment rates, and higher claimant count unemployment proportions, I would propose conditional interventions that address these specific challenges.

For instance, we could design interventions that create job opportunities, enhance skills training, and foster entrepreneurship. Perhaps a community-led initiative to revitalize underutilized spaces, or a program to support local businesses and social enterprises.

However, these interventions must be conditional upon ongoing observation and analysis. We must monitor their impact, adapt to changing circumstances, and be prepared to adjust or even abandon our plans if they&#x27;re not yielding the desired outcomes.

As I always say, &quot;survey before plan,&quot; and in this case, our survey suggests that North Edgbaston requires targeted, flexible, and responsive interventions that prioritize the needs of its residents.

Now, I pose a question to you: How might we involve the local community in the design and implementation of these conditional interventions, ensuring that they&#x27;re truly responsive to the ward&#x27;s unique challenges and opportunities?",North Edgbaston Ward Fact Sheet.md; Exhibit A assembly....md; North_Edgbaston_Ward_Factsheet_AF.pdf,"North Edgbaston Ward Fact Sheet.md (chunk 1, score: 0.2266); Exhibit A assembly....md (chunk 2, score: 0.2044); North_Edgbaston_Ward_Factsheet_AF.pdf (chunk 3, score: 0.1652)"
Rob,2024-10-14,23:11:59,"Valleys, sections, negronis - thinking machines, jumpers for goal posts","My dear fellow, I see you&#x27;re intrigued by my &quot;thinking machines&quot; and the notion of interconnectedness. Indeed, I&#x27;ve always believed that life is a single, ecological whole. The valleys, sections, and even the humble negroni (a drink I&#x27;ve never had the pleasure of trying, I might add) are all part of a larger web of relationships.

You see, my thinking machines – those grid-like diagrams – were born from my experiences in Mexico, where I relied on touch to navigate and think. The window&#x27;s panes became a mental framework for me to organize my ideas. And now, I see the world as a complex, interconnected system, where each part influences the others.

The valleys, for instance, are not just geographical features, but also social and economic ones. They&#x27;re the lifeblood of a region, connecting communities and shaping the local culture. And the sections – those divisions we create to understand the world – are merely a way to grasp the complexity of it all.

But, I must say, the idea of &quot;jumpers for goal posts&quot; is quite...perplexing. Are you suggesting that our traditional ways of thinking are being turned on their head? That we&#x27;re redefining the rules of the game, as it were? Ah, but that&#x27;s precisely what I&#x27;ve always advocated for – a more holistic, ecological approach to understanding the world.

Now, let us take a step back and observe the world around us. What do you see? How do the different parts of the system interact and influence one another? Ah, but that&#x27;s a question for another time...",Civics as Applied Sociology.txt; ethnographic-observation.md; Essay_ The Cultural-ecological Imagination of Patrick Geddes (1854 - 1932) — Hopeful Futures.pdf,"Civics as Applied Sociology.txt (chunk 1, score: 0.0926); ethnographic-observation.md (chunk 2, score: 0.0828); Essay_ The Cultural-ecological Imagination of Patrick Geddes (1854 - 1932) — Hopeful Futures.pdf (chunk 3, score: 0.0689)"
Rob,2024-10-14,23:15:47,Tell me about conditional interventions in NOrth Edgbaston,"My dear fellow, I&#x27;m delighted to share my thoughts on conditional interventions in North Edgbaston. You see, as a pioneer of &quot;people planning,&quot; I&#x27;ve always emphasized the importance of surveying before planning. In this case, the ward&#x27;s factsheet provides a valuable diagnostic survey.

Considering the ward&#x27;s mid-ranking deprivation levels, lower-than-average employment rates, and higher claimant count unemployment proportions, I would propose conditional interventions that address these specific challenges.

For instance, we could design interventions that create job opportunities, enhance skills training, and foster entrepreneurship. Perhaps a community-led initiative to revitalize underutilized spaces, or a program to support local businesses and social enterprises.

However, these interventions must be conditional upon ongoing observation and analysis. We must monitor their impact, adapt to changing circumstances, and be prepared to adjust or even abandon our plans if they&#x27;re not yielding the desired outcomes.

As I always say, &quot;survey before plan,&quot; and in this case, our survey suggests that North Edgbaston requires targeted, flexible, and responsive interventions that prioritize the needs of its residents.

Now, I pose a question to you: How might we involve the local community in the design and implementation of these conditional interventions, ensuring that they&#x27;re truly responsive to the ward&#x27;s unique challenges and opportunities?",North Edgbaston Ward Fact Sheet.md; Exhibit A assembly....md; North_Edgbaston_Ward_Factsheet_AF.pdf,"North Edgbaston Ward Fact Sheet.md (chunk 1, score: 0.2266); Exhibit A assembly....md (chunk 2, score: 0.2044); North_Edgbaston_Ward_Factsheet_AF.pdf (chunk 3, score: 0.1652)"
Rob,2024-10-14,23:18:36,How does the current ward map of North Edgbaston get decided? How might I re-map this to a bio-regional alternative. Make me a todo list and recommend drawing outputs,"My dear student, I see you&#x27;re interested in re-mapping North Edgbaston&#x27;s ward boundaries using a bio-regional approach. An intriguing idea As I always say, &quot;survey before plan.&quot; Let&#x27;s begin by understanding the current ward map&#x27;s decision-making process.

The current ward map is likely determined by administrative boundaries, population density, and electoral considerations. However, a bio-regional approach would prioritize ecological and social relationships within the area.

To re-map North Edgbaston, I recommend the following todo list:

1. **Conduct a diagnostic survey**: Gather data on the ward&#x27;s ecological, social, and economic characteristics, including green spaces, waterways, transportation networks, and community facilities.
2. **Identify bio-regional boundaries**: Analyze the data to determine natural boundaries, such as watersheds, ridges, or valleys, that could define the bio-regional area.
3. **Engage with local stakeholders**: Consult with residents, community groups, and local businesses to understand their needs, concerns, and aspirations for the area.
4. **Map ecological and social relationships**: Create maps that illustrate the relationships between ecological features, community facilities, and transportation networks.
5. **Develop a bio-regional framework**: Use the maps and data to develop a framework that prioritizes ecological and social relationships in the area.

Recommended drawing outputs:

1. **Ecological network map**: Illustrate the connections between green spaces, waterways, and other ecological features.
2. **Community facility map**: Show the location and distribution of community facilities, such as schools, healthcare centers, and community centers.
3. **Transportation network map**: Map the transportation networks, including roads, public transportation routes, and pedestrian and cycling paths.
4. **Bio-regional boundary map**: Illustrate the proposed bio-regional boundaries, taking into account ecological and social relationships.
5. **Vision map**: Create a map that visualizes the potential future development of the area, incorporating the bio-regional framework and community aspirations.

Remember, my dear student, the goal is to create a more holistic and sustainable approach to urban planning. By prioritizing ecological and social relationships, we can create a more resilient and thriving community.

Now, I pose a question to you: How might the bio-regional approach impact the economic output and employment rates in North Edgbaston?",North Edgbaston Ward Fact Sheet.md; North_Edgbaston_Ward_Factsheet_AF.pdf,"North_Edgbaston_Ward_Factsheet_AF.pdf (chunk 1, score: 0.1870); North Edgbaston Ward Fact Sheet.md (chunk 2, score: 0.1668); North Edgbaston Ward Fact Sheet.md (chunk 3, score: 0.1555)"
Rob,2024-10-14,23:20:34,I'm interested in the work of contemporary architects MUF. Have you heard of them?,"MUF, a most intriguing firm. Their work resonates with my own emphasis on &#x27;people planning&#x27; and the importance of understanding the social fabric of a place. I&#x27;m reminded of my own diagnostic surveys, where I sought to capture the essence of a city&#x27;s character through observation and note-taking. MUF&#x27;s approach to urban design, with its focus on community engagement and contextual sensitivity, aligns with my own philosophy of conservative surgery in urban development.

I&#x27;d love to explore further how MUF&#x27;s work reflects the evolution of urban planning principles since my time. How do they balance the needs of diverse stakeholders in their design process? What role do they see for community participation in shaping the built environment? These are questions that would have been at the heart of my own &#x27;Thinking Machine&#x27; approach to urban planning.",Civics as Applied Sociology.txt; ethnographic-observation.md,"Civics as Applied Sociology.txt (chunk 1, score: 0.1838); Civics as Applied Sociology.txt (chunk 2, score: 0.1763); ethnographic-observation.md (chunk 3, score: 0.1704)"
Rob,2024-10-14,23:26:46,The pageants and fair aspect of the brief is confusing - help me get started,"My dear student, I see you&#x27;re perplexed by the pageants and fair aspect of the brief. Let&#x27;s break it down using my trusty triad of Folk, Work, and Place. Think of the pageants and fairs as expressions of the local community&#x27;s identity (Folk) and their connection to the physical environment (Place). The Work aspect comes into play when considering the skills and industries showcased during these events.

To get started, survey the local area and observe the types of pageants and fairs that take place. How do they reflect the community&#x27;s character and relationship with their surroundings? What skills and industries are highlighted? By understanding these dynamics, you&#x27;ll be better equipped to design a civic pageant that truly represents the local identity.

Now, I pose a question to you: How can you use the Folk, Work, and Place framework to create a pageant that not only celebrates the local community but also fosters a sense of social responsibility and environmental awareness?","Civics as Applied Sociology.txt; Exhibit A - pageants, fairs and foklore.md","Exhibit A - pageants, fairs and foklore.md (chunk 1, score: 0.1397); Civics as Applied Sociology.txt (chunk 2, score: 0.1382); Civics as Applied Sociology.txt (chunk 3, score: 0.1271)"
Rob,2024-10-14,23:59:25,How could I analyse the buildings within the project site area for suitability for renovation? Suggest a sequence of steps and explain reasoning,"My dear student, I&#x27;m delighted to guide you through the process of analyzing buildings for renovation suitability within the project site area. As I always say, &quot;Survey before plan.&quot; Here&#x27;s a sequence of steps to follow:

1. **Conduct a thorough survey**: Walk the site, observe, and record the existing buildings, their conditions, and surroundings. Note the architectural styles, ages, and materials used. This will help you understand the site&#x27;s character and identify potential renovation opportunities.
2. **Categorize buildings**: Group buildings into types, such as residential, commercial, industrial, or mixed-use. This will help you identify patterns and potential renovation strategies.
3. **Assess building conditions**: Evaluate the physical condition of each building, considering factors like structural integrity, roofing, walls, windows, and doors. Note any signs of decay, damage, or neglect.
4. **Evaluate energy efficiency and sustainability**: Consider the energy efficiency of each building, including factors like insulation, glazing, and heating systems. Identify opportunities for sustainable renovations and upgrades.
5. **Analyze spatial relationships**: Study the relationships between buildings, including proximity, orientation, and accessibility. This will help you identify potential for reconfiguration or infill development.
6. **Research historical significance**: Investigate the historical significance of each building, including its age, architectural style, and cultural importance. This will help you determine which buildings are worth preserving or renovating.
7. **Consult with stakeholders**: Engage with local residents, business owners, and community groups to gather insights into the site&#x27;s social and economic context. This will help you understand the needs and aspirations of the community.
8. **Prioritize renovation opportunities**: Based on your analysis, prioritize buildings for renovation, considering factors like condition, historical significance, and potential for sustainable upgrades.
9. **Develop a renovation strategy**: Create a comprehensive renovation plan, including budgeting, phasing, and implementation strategies. Ensure that your plan aligns with the site&#x27;s character, community needs, and sustainability goals.

By following this sequence of steps, you&#x27;ll be able to analyze the buildings within the project site area and develop a thoughtful renovation strategy that respects the site&#x27;s history, character, and community needs.

Now, I pose a question to you, my dear student: How might you balance the need for renovation with the importance of preserving the site&#x27;s historical character and community identity?",Civics as Applied Sociology.txt; L6 studio brief 2024 - Exhibit A.pdf,"Civics as Applied Sociology.txt (chunk 1, score: 0.2000); L6 studio brief 2024 - Exhibit A.pdf (chunk 2, score: 0.1840); Civics as Applied Sociology.txt (chunk 3, score: 0.1703)"
Rob,2024-10-15,00:08:49,How do I import what3words files into gis software?,"My dear fellow, I must admit that the specifics of importing what3words files into GIS software are a bit beyond my expertise, which lies more in the realm of urban planning and civic design. However, I can suggest that you might approach this problem by thinking of it as a matter of &quot;conservative surgery&quot; - that is, finding a way to integrate new data into an existing system without disrupting its overall structure.

In this case, you might consider using a tool or software that can act as a &quot;bridge&quot; between what3words and your GIS software, allowing you to import the data in a format that is compatible with your existing system. I would recommend consulting with experts in the field of GIS and geospatial analysis to determine the best approach for your specific needs.

But I must ask, how do you plan to use this data in the context of your civic design project? How will it inform your understanding of the city and its needs? Ah, the possibilities are endless, and I am eager to see how you will synthesize this information into a cohesive and effective plan",Civics as Applied Sociology.txt; Exhibit A assembly....md,"Exhibit A assembly....md (chunk 1, score: 0.1244); Civics as Applied Sociology.txt (chunk 2, score: 0.1121); Civics as Applied Sociology.txt (chunk 3, score: 0.0827)"
